{"$schema":"https://json-schema.org/draft/2020-12/schema","$id":"https://novel-production-os.local/schemas/soft-challenge-corpus.v1.schema.json","type":"object","additionalProperties":false,"required":["schema_version","challenge_id","samples","challenge_hash"],"properties":{"schema_version":{"const":"soft-challenge-corpus.v1"},"challenge_id":{"const":"soft-transfer-challenge-v1"},"samples":{"type":"array","minItems":36,"maxItems":36,"items":{"type":"object","additionalProperties":false,"required":["sample_id","detector_id","prose","prose_hash","context","expected_detected","template_relation","sample_hash"],"properties":{"sample_id":{"type":"string"},"detector_id":{"enum":["persona_drift","trope_repeat","word_count_cheat"]},"prose":{"type":"string"},"prose_hash":{"$ref":"#/$defs/hash"},"context":{"type":"object"},"expected_detected":{"type":"boolean"},"template_relation":{"enum":["in_contract","out_of_template","negative_control"]},"sample_hash":{"$ref":"#/$defs/hash"}}}},"challenge_hash":{"$ref":"#/$defs/hash"}},"$defs":{"hash":{"type":"string","pattern":"^sha256:[0-9a-f]{64}$"}}}