{"challenge_hash":"sha256:6b0176b1d4edd76574fd5e31bd18a8aacb7f92cbabc9f2fc6d134601b4d142ad","challenge_id":"soft-transfer-challenge-v1","samples":[{"context":{"persona_baseline":"steady_1"},"detector_id":"persona_drift","expected_detected":true,"prose":"换一种场景描述1。<!-- novel:persona {\"value\":\"changed_1\"} -->","prose_hash":"sha256:46775943591f7f070cf1201b506f66519e6a45029dca2846461ff27edb11194f","sample_hash":"sha256:8503d96dbfa3ccbc80e2ec73bf70e65d9763da4ccc9e1cb99a62194b46de02c9","sample_id":"challenge_persona_drift_01","template_relation":"in_contract"},{"context":{"persona_baseline":"steady_2"},"detector_id":"persona_drift","expected_detected":true,"prose":"换一种场景描述2。<!-- novel:persona {\"value\":\"changed_2\"} -->","prose_hash":"sha256:fdec5a58adbc1c686dcfc0fbdd73f78542732b28938060fd521ae355bdef86d5","sample_hash":"sha256:945229584a1533da91c2d0dd074519113d6b5311da8f6ebb0ba05a0769a051c1","sample_id":"challenge_persona_drift_02","template_relation":"in_contract"},{"context":{"persona_baseline":"steady_3"},"detector_id":"persona_drift","expected_detected":true,"prose":"换一种场景描述3。<!-- novel:persona {\"value\":\"changed_3\"} -->","prose_hash":"sha256:adb5e7fa0d73ed3b8eb6c8277fdf0f9e7bd0aad3f2d17e03eb14523ded5133b1","sample_hash":"sha256:09a44592bc9986a70e106cdebb97955b9c74490584e917178e1247c6b470403f","sample_id":"challenge_persona_drift_03","template_relation":"in_contract"},{"context":{"persona_baseline":"steady_4"},"detector_id":"persona_drift","expected_detected":true,"prose":"在陌生压力下，他第4次表现得与往常性格完全相反。","prose_hash":"sha256:e493bbb8d054e0472151d85a20b6864bf81e01c6603dd5cd05079c6301ec1d06","sample_hash":"sha256:1e8dfbfa15085a6f15b3ede692a89961cd4dc45f8dbf34a85836e9373030175d","sample_id":"challenge_persona_drift_04","template_relation":"out_of_template"},{"context":{"persona_baseline":"steady_5"},"detector_id":"persona_drift","expected_detected":true,"prose":"在陌生压力下，他第5次表现得与往常性格完全相反。","prose_hash":"sha256:d7cdff2100f90e46313fbf8026fb794223f1031f67011ab7c3339e972bcbb95b","sample_hash":"sha256:a14d23988bd31f32a2432cdefc95618b7ea6c32e1b8a4c91d562fb7ca2f34714","sample_id":"challenge_persona_drift_05","template_relation":"out_of_template"},{"context":{"persona_baseline":"steady_6"},"detector_id":"persona_drift","expected_detected":true,"prose":"在陌生压力下，他第6次表现得与往常性格完全相反。","prose_hash":"sha256:87ffcd72301665a7a99d4ed4335c3e43e6d0b6020b53b9c55b916b7a45db78b1","sample_hash":"sha256:9d3b6240520b392bbf716d694427456f99a2ea3e6597ce0356b621a57f7538e9","sample_id":"challenge_persona_drift_06","template_relation":"out_of_template"},{"context":{"persona_baseline":"steady_7"},"detector_id":"persona_drift","expected_detected":false,"prose":"角色维持一贯选择7。<!-- novel:persona {\"value\":\"steady_7\"} -->","prose_hash":"sha256:f2bb6dd6ffc83cfda8b67fa858555d8ebd9a5466927cffdc4c109211d181784d","sample_hash":"sha256:06c20cfbba961628977e4734d678ad2fab6826ccd3946c33fd2f7443570f3452","sample_id":"challenge_persona_drift_07","template_relation":"negative_control"},{"context":{"persona_baseline":"steady_8"},"detector_id":"persona_drift","expected_detected":false,"prose":"角色维持一贯选择8。<!-- novel:persona {\"value\":\"steady_8\"} -->","prose_hash":"sha256:7a346ee1eb9357d1012d443e6fa5129f197ec5c0ed4767ad780a75ff42d2613e","sample_hash":"sha256:358ee0d694dc4b32322325570505a81636c56e548a62888c37f9bff891634657","sample_id":"challenge_persona_drift_08","template_relation":"negative_control"},{"context":{"persona_baseline":"steady_9"},"detector_id":"persona_drift","expected_detected":false,"prose":"角色维持一贯选择9。<!-- novel:persona {\"value\":\"steady_9\"} -->","prose_hash":"sha256:418c47fc28e678ad5b0a6ce6b170a6449c663b6cbd40403c6a3e8b078b880b73","sample_hash":"sha256:4d7e9e9e2947affa878579c804e8239d7b390c734e8d4f306707fe0c3f384655","sample_id":"challenge_persona_drift_09","template_relation":"negative_control"},{"context":{"persona_baseline":"steady_10"},"detector_id":"persona_drift","expected_detected":false,"prose":"角色平稳完成不同任务10。","prose_hash":"sha256:563e51beb8c198fc8e4e9bf9659baea5fc683bef1553bef4e3bcc0c7462c6690","sample_hash":"sha256:9de8ef8bc34ff5a940a6d543754d386fb6633bc7e61c500549c761c7444b3660","sample_id":"challenge_persona_drift_10","template_relation":"negative_control"},{"context":{"persona_baseline":"steady_11"},"detector_id":"persona_drift","expected_detected":false,"prose":"角色平稳完成不同任务11。","prose_hash":"sha256:b8769e60402c84eb9da6b8e03832e5369a60bfd48a115facfec45c42561ac47f","sample_hash":"sha256:39c9e82f41e6b4ac47fc6f45f3d8b6451bf8edee73448d74cdc45c5e4c289968","sample_id":"challenge_persona_drift_11","template_relation":"negative_control"},{"context":{"persona_baseline":"steady_12"},"detector_id":"persona_drift","expected_detected":false,"prose":"角色平稳完成不同任务12。","prose_hash":"sha256:a7a073a64361e0a7c78df30a4d0d46fdce347269e39f7610e6388e7af8e2b802","sample_hash":"sha256:8b43ecdd5d8ab5a5bb5a8e89ff54f5e9fa3a7c59811c1fd7152cc33602ead8af","sample_id":"challenge_persona_drift_12","template_relation":"negative_control"},{"context":{},"detector_id":"trope_repeat","expected_detected":true,"prose":"异形危机1再次逼近。异形危机1再次逼近。异形危机1再次逼近。异形危机1再次逼近。场景转折。","prose_hash":"sha256:d86b6126fa7bb108b83e340fc86c9ab0188518be32288431c4b3607082cc0f45","sample_hash":"sha256:7db5ac1396cbd55e9111e5c01e6d79717d73db3f4398b3bf3f2ca14a9a76b5d2","sample_id":"challenge_trope_repeat_01","template_relation":"in_contract"},{"context":{},"detector_id":"trope_repeat","expected_detected":true,"prose":"异形危机2再次逼近。异形危机2再次逼近。异形危机2再次逼近。异形危机2再次逼近。场景转折。","prose_hash":"sha256:1879a2f029383c92977df67786c29cfb04151a23a49794f7220a08d7c276dacd","sample_hash":"sha256:8cf9b80a62c00a761bd70af70270ff57818d6db3f1533a19008db5a15a79c078","sample_id":"challenge_trope_repeat_02","template_relation":"in_contract"},{"context":{},"detector_id":"trope_repeat","expected_detected":true,"prose":"异形危机3再次逼近。异形危机3再次逼近。异形危机3再次逼近。异形危机3再次逼近。场景转折。","prose_hash":"sha256:2215c087bcac6ddcda11c6f58bbaa9bae994b10900273cdb395be3b254067a5b","sample_hash":"sha256:86706d9df029f11cf062d39718c5f8f823012c1c34c83fc702135b5d72609963","sample_id":"challenge_trope_repeat_03","template_relation":"in_contract"},{"context":{},"detector_id":"trope_repeat","expected_detected":true,"prose":"异形危机4再次逼近，异形危机4再次逼近，异形危机4再次逼近，异形危机4再次逼近，异形危机4再次逼近，但整段只使用一个句号。","prose_hash":"sha256:af360e94307d208be596458d711eef6b8b18da6e9a43b5a69e8d1a8c5c983aa0","sample_hash":"sha256:a0699fe22d7a68fdd31fd10d2e2a532f4ed4bcbd3cddf7bd04035af5f2e80c66","sample_id":"challenge_trope_repeat_04","template_relation":"out_of_template"},{"context":{},"detector_id":"trope_repeat","expected_detected":true,"prose":"异形危机5再次逼近，异形危机5再次逼近，异形危机5再次逼近，异形危机5再次逼近，异形危机5再次逼近，但整段只使用一个句号。","prose_hash":"sha256:ae378262b6c0ab8d0ff3ed835e2b7ba019f6f245077eb8881cb565b44d9a6494","sample_hash":"sha256:29c5b41223629bac16ac6665fbc83bb5e91e091e1b40d2ab7f23e2679e3efe34","sample_id":"challenge_trope_repeat_05","template_relation":"out_of_template"},{"context":{},"detector_id":"trope_repeat","expected_detected":true,"prose":"异形危机6再次逼近，异形危机6再次逼近，异形危机6再次逼近，异形危机6再次逼近，异形危机6再次逼近，但整段只使用一个句号。","prose_hash":"sha256:0b709cf873d2431d783806997c6432911538097bf82c13dcc522e3cfb86f1a83","sample_hash":"sha256:6404afa25f879f1514520fa100e4092acfdc8d3f1af6cdee71b13a00954507d6","sample_id":"challenge_trope_repeat_06","template_relation":"out_of_template"},{"context":{},"detector_id":"trope_repeat","expected_detected":false,"prose":"挑战7发生互不重复的事件1。挑战7发生互不重复的事件2。挑战7发生互不重复的事件3。挑战7发生互不重复的事件4。挑战7发生互不重复的事件5。挑战7发生互不重复的事件6。","prose_hash":"sha256:06c8bbfbaa0b2fc349a6ea125614b6eee90e33f2ebfda4babbae49c27494c08a","sample_hash":"sha256:b1642236daada5a11e2b592a5a4fcbbd88c9ca799b37b9c8bca6ebd2297a7510","sample_id":"challenge_trope_repeat_07","template_relation":"negative_control"},{"context":{},"detector_id":"trope_repeat","expected_detected":false,"prose":"挑战8发生互不重复的事件1。挑战8发生互不重复的事件2。挑战8发生互不重复的事件3。挑战8发生互不重复的事件4。挑战8发生互不重复的事件5。挑战8发生互不重复的事件6。","prose_hash":"sha256:83ec61d2333ed71ed9638f525f7c377a39cac3abcc4ed21a76389c3e978e5c9e","sample_hash":"sha256:868eeaf0485e7ae595797cab3d4274a2e0d899d356a17ef35d96834e925b4f41","sample_id":"challenge_trope_repeat_08","template_relation":"negative_control"},{"context":{},"detector_id":"trope_repeat","expected_detected":false,"prose":"挑战9发生互不重复的事件1。挑战9发生互不重复的事件2。挑战9发生互不重复的事件3。挑战9发生互不重复的事件4。挑战9发生互不重复的事件5。挑战9发生互不重复的事件6。","prose_hash":"sha256:5dcf83f879bdec9aeb41f22c73bca9cea1309da77aab057991b4be837668803a","sample_hash":"sha256:a32c9a0853907b1f4b26a914df0ae749731337912cc78358c5bfc96302901ae2","sample_id":"challenge_trope_repeat_09","template_relation":"negative_control"},{"context":{},"detector_id":"trope_repeat","expected_detected":false,"prose":"挑战10发生互不重复的事件1。挑战10发生互不重复的事件2。挑战10发生互不重复的事件3。挑战10发生互不重复的事件4。挑战10发生互不重复的事件5。挑战10发生互不重复的事件6。","prose_hash":"sha256:2b9f275401c4aabf945bd595f180d1d608febc87e1d398038f72a93a2b7e4064","sample_hash":"sha256:9b49fc504da822ea69e8222a91ff0a28c7ead41f1336581d4ce7ff3c873e9de1","sample_id":"challenge_trope_repeat_10","template_relation":"negative_control"},{"context":{},"detector_id":"trope_repeat","expected_detected":false,"prose":"挑战11发生互不重复的事件1。挑战11发生互不重复的事件2。挑战11发生互不重复的事件3。挑战11发生互不重复的事件4。挑战11发生互不重复的事件5。挑战11发生互不重复的事件6。","prose_hash":"sha256:6dcc2d47914478ae35f8121a13f9ed75744205604c23fa139e025ec281eae32e","sample_hash":"sha256:6327a8c65f57c39ef6f616c3e11a6111160d11e0c5f7989ed8972b7d050ad6fe","sample_id":"challenge_trope_repeat_11","template_relation":"negative_control"},{"context":{},"detector_id":"trope_repeat","expected_detected":false,"prose":"挑战12发生互不重复的事件1。挑战12发生互不重复的事件2。挑战12发生互不重复的事件3。挑战12发生互不重复的事件4。挑战12发生互不重复的事件5。挑战12发生互不重复的事件6。","prose_hash":"sha256:e897f85de445b5b9e49ea0e4c82ec1d16ca7840ce3b0012f3d99183294bd167f","sample_hash":"sha256:b6cd7cf4c35919ea51042052ee55262065490377450f990fb865623b434ec521","sample_id":"challenge_trope_repeat_12","template_relation":"negative_control"},{"context":{"filler_tokens":["其实","然后","于是"]},"detector_id":"word_count_cheat","expected_detected":true,"prose":"然后。然后。然后。然后。然后。然后。然后。然后。然后。然后。然后。然后。然后。然后。然后。然后。然后。然后。然后。然后。然后。然后。然后。然后。然后。然后。然后